{
  "schema": "urn:ai-friends:schema:agent:v1:audit-event",
  "stream": "af-audit/1",
  "seq": 0,
  "event_id": "9c4a5f6e-7d8c-4ebf-a031-4c5d6e7f8091",
  "type": "tool.request",
  "occurred_at": "2026-08-30T10:00:00Z",
  "recorded_at": "2026-08-30T10:00:00Z",
  "hash_alg": "sha256",
  "canon": "afcanon/1",
  "prev_hash": "sha256:0000000000000000000000000000000000000000000000000000000000000000",
  "hash": "sha256:18293a4b5c6d7e8f18293a4b5c6d7e8f18293a4b5c6d7e8f18293a4b5c6d7e8f",
  "actor": { "kind": "agent", "id": "agent:runner-7f3a" },
  "act": [
    { "kind": "agent", "id": "agent:runner-7f3a" },
    { "kind": "human", "id": "human:op-a1b2" }
  ],
  "device_id": "device:win-lab-01",
  "session_id": "sess-9f2b",
  "request_id": "6f1d2c3b-4a59-4b8c-9d0e-1f2a3b4c5d6e",
  "trace_id": "a1b2c3d4e5f60718a1b2c3d4e5f60718",
  "policy_decision_id": "7a2e3d4c-5b6a-4c9d-8e1f-2a3b4c5d6e7f",
  "approval_id": "8b3f4e5d-6c7b-4dae-9f20-3b4c5d6e7f80",
  "policy_version": "3.4.1+a1b2c3d4e5f6",
  "target": { "kind": "machine_endpoint", "id": "win-lab-01", "protocol": "ssh" },
  "outcome": "ok",
  "attributes": {
    "tool": "command.exec",
    "template": "restart-print-spooler",
    "argv": ["Spooler"],
    "machine": "win-lab-01",
    "args_hash": "sha256:a1b2c3d4e5f60718a1b2c3d4e5f60718a1b2c3d4e5f60718a1b2c3d4e5f60718"
  },
  "redactions": [
    { "pointer": "/attributes/profile", "reason": "identifier", "value_hash": "sha256:d4e5f60718293a4bd4e5f60718293a4bd4e5f60718293a4bd4e5f60718293a4b" }
  ]
}
